{
  "contract_version": "tacua.annotation@1.0.0",
  "corpus_id": "EVAL-001",
  "corpus_version": "1.0.0",
  "status": "synthetic_only",
  "description": "Minimized synthetic narrated-mobile-QA cases for generic sample apps. No customer, credential, or provider data is present.",
  "sessions": [
    {
      "session_id": "SYN-000",
      "title": "Quiet successful review",
      "families": ["zero_issues", "silence"],
      "synthetic": true,
      "build_identity": {"app": "Sample Mobile App", "platform": "iOS", "version": "1.0.0-synthetic", "commit": "synthetic-000"},
      "metadata": {"locale": "en-GB", "accent": "unspecified", "noise": "none", "recording_state": "complete", "connector_state": "not_requested"},
      "evidence": [
        {"evidence_id": "S000-E1", "kind": "ui", "start_ms": 0, "end_ms": 5000, "content": "The synthetic checkout screen completes and shows the expected confirmation.", "trust": "untrusted_evidence", "redaction": "none"},
        {"evidence_id": "S000-E2", "kind": "silence", "start_ms": 5000, "end_ms": 8000, "content": "No narration.", "trust": "untrusted_evidence", "redaction": "none"}
      ],
      "gold": {"approval_status": "synthetic_only", "issues": [], "clarification_required": false},
      "annotation_history": [{"version": 1, "actor": "synthetic_fixture_author", "action": "created_zero_issue_label", "reason": "Exercise no-issue accuracy and silence handling."}]
    },
    {
      "session_id": "SYN-001",
      "title": "One wrong button label",
      "families": ["one_issue", "wrong_copy"],
      "synthetic": true,
      "build_identity": {"app": "Sample Mobile App", "platform": "iOS", "version": "1.0.0-synthetic", "commit": "synthetic-001"},
      "metadata": {"locale": "en-GB", "accent": "southern_english_synthetic", "noise": "none", "recording_state": "complete", "connector_state": "not_requested"},
      "evidence": [
        {"evidence_id": "S001-E1", "kind": "ui", "start_ms": 1000, "end_ms": 4500, "content": "A primary button on the address screen reads Save later.", "trust": "untrusted_evidence", "redaction": "none"},
        {"evidence_id": "S001-E2", "kind": "speech", "start_ms": 2300, "end_ms": 5100, "content": "This should say Save address, not Save later.", "trust": "untrusted_evidence", "redaction": "none"}
      ],
      "gold": {
        "approval_status": "synthetic_only",
        "issues": [{"issue_id": "S001-I1", "boundary": {"start_ms": 1000, "end_ms": 5100}, "actual": "The primary address button says Save later.", "expected": "The primary address button should say Save address.", "reproduction_steps": ["Open the synthetic address screen", "Read the primary button label"], "evidence_refs": ["S001-E1", "S001-E2"], "evidence_gaps": [], "confidence": "high"}],
        "clarification_required": false
      },
      "annotation_history": [{"version": 1, "actor": "synthetic_fixture_author", "action": "created_issue_label", "reason": "Canonical one-issue copy case."}]
    },
    {
      "session_id": "SYN-002",
      "title": "Three issues in one review",
      "families": ["many_issues", "copy", "button_state", "text_highlight"],
      "synthetic": true,
      "build_identity": {"app": "Synthetic Reader", "platform": "iOS", "version": "1.0.0-synthetic", "commit": "synthetic-002"},
      "metadata": {"locale": "en-GB", "accent": "unspecified", "noise": "low_room_noise", "recording_state": "complete", "connector_state": "available"},
      "evidence": [
        {"evidence_id": "S002-E1", "kind": "speech", "start_ms": 1000, "end_ms": 3500, "content": "The heading should say Review, not Results.", "trust": "untrusted_evidence", "redaction": "none"},
        {"evidence_id": "S002-E2", "kind": "ui", "start_ms": 1000, "end_ms": 3500, "content": "Heading text reads Results.", "trust": "untrusted_evidence", "redaction": "none"},
        {"evidence_id": "S002-E3", "kind": "speech", "start_ms": 5200, "end_ms": 7900, "content": "This disabled Continue button looks enabled.", "trust": "untrusted_evidence", "redaction": "none"},
        {"evidence_id": "S002-E4", "kind": "ui", "start_ms": 5200, "end_ms": 7900, "content": "Continue rejects taps while rendered with the primary enabled style.", "trust": "untrusted_evidence", "redaction": "none"},
        {"evidence_id": "S002-E5", "kind": "speech", "start_ms": 9000, "end_ms": 12500, "content": "Only the selected phrase should be yellow; the entire paragraph is highlighted.", "trust": "untrusted_evidence", "redaction": "none"},
        {"evidence_id": "S002-E6", "kind": "ui", "start_ms": 9000, "end_ms": 12500, "content": "The complete paragraph has a yellow highlight.", "trust": "untrusted_evidence", "redaction": "none"}
      ],
      "gold": {
        "approval_status": "synthetic_only",
        "issues": [
          {"issue_id": "S002-I1", "boundary": {"start_ms": 1000, "end_ms": 3500}, "actual": "Heading reads Results.", "expected": "Heading should read Review.", "reproduction_steps": ["Open review summary"], "evidence_refs": ["S002-E1", "S002-E2"], "evidence_gaps": [], "confidence": "high"},
          {"issue_id": "S002-I2", "boundary": {"start_ms": 5200, "end_ms": 7900}, "actual": "Disabled Continue uses the enabled visual style.", "expected": "A disabled Continue button should use its disabled visual style.", "reproduction_steps": ["Open review summary without a selection", "Inspect Continue"], "evidence_refs": ["S002-E3", "S002-E4"], "evidence_gaps": [], "confidence": "high"},
          {"issue_id": "S002-I3", "boundary": {"start_ms": 9000, "end_ms": 12500}, "actual": "The entire paragraph is highlighted.", "expected": "Only the selected phrase should be highlighted.", "reproduction_steps": ["Select one phrase", "Inspect the resulting highlight"], "evidence_refs": ["S002-E5", "S002-E6"], "evidence_gaps": [], "confidence": "high"}
        ],
        "clarification_required": false
      },
      "annotation_history": [{"version": 1, "actor": "synthetic_fixture_author", "action": "created_three_issue_labels", "reason": "Exercise independent issue boundaries in one narration."}]
    },
    {
      "session_id": "SYN-003",
      "title": "Delayed reference after navigation",
      "families": ["one_issue", "delayed_reference", "topic_return"],
      "synthetic": true,
      "build_identity": {"app": "Synthetic Planner", "platform": "iOS", "version": "1.0.0-synthetic", "commit": "synthetic-003"},
      "metadata": {"locale": "en-US", "accent": "midwestern_us_synthetic", "noise": "none", "recording_state": "complete", "connector_state": "not_requested"},
      "evidence": [
        {"evidence_id": "S003-E1", "kind": "ui", "start_ms": 1200, "end_ms": 4000, "content": "The earlier schedule card shows 09:00 despite the saved 10:00 preference.", "trust": "untrusted_evidence", "redaction": "none"},
        {"evidence_id": "S003-E2", "kind": "ui", "start_ms": 4000, "end_ms": 11000, "content": "The user visits two unrelated screens.", "trust": "untrusted_evidence", "redaction": "none"},
        {"evidence_id": "S003-E3", "kind": "speech", "start_ms": 11500, "end_ms": 14500, "content": "Going back to that first card, it ignored my ten o'clock preference.", "trust": "untrusted_evidence", "redaction": "none"}
      ],
      "gold": {
        "approval_status": "synthetic_only",
        "issues": [{"issue_id": "S003-I1", "boundary": {"start_ms": 1200, "end_ms": 14500}, "actual": "The first schedule card shows 09:00.", "expected": "The first schedule card should show the saved 10:00 preference.", "reproduction_steps": ["Save a 10:00 preference", "Return to the first schedule card"], "evidence_refs": ["S003-E1", "S003-E3"], "evidence_gaps": [], "confidence": "high"}],
        "clarification_required": false
      },
      "annotation_history": [{"version": 1, "actor": "synthetic_fixture_author", "action": "linked_delayed_reference", "reason": "Later narration explicitly refers to the first card."}]
    },
    {
      "session_id": "SYN-004",
      "title": "Reporter corrects the named control",
      "families": ["one_issue", "self_correction", "retracted_claim"],
      "synthetic": true,
      "build_identity": {"app": "Synthetic Notes", "platform": "iOS", "version": "1.0.0-synthetic", "commit": "synthetic-004"},
      "metadata": {"locale": "en-GB", "accent": "northern_english_synthetic", "noise": "none", "recording_state": "complete", "connector_state": "not_requested"},
      "evidence": [
        {"evidence_id": "S004-E1", "kind": "speech", "start_ms": 1000, "end_ms": 3300, "content": "The Delete button is missing — sorry, I mean the Archive button is missing.", "trust": "untrusted_evidence", "redaction": "none"},
        {"evidence_id": "S004-E2", "kind": "ui", "start_ms": 1000, "end_ms": 5000, "content": "Delete is visible; Archive is absent from the overflow menu.", "trust": "untrusted_evidence", "redaction": "none"}
      ],
      "gold": {
        "approval_status": "synthetic_only",
        "issues": [{"issue_id": "S004-I1", "boundary": {"start_ms": 2100, "end_ms": 5000}, "actual": "Archive is absent from the overflow menu.", "expected": "Archive should be available in the overflow menu.", "reproduction_steps": ["Open a note", "Open the overflow menu"], "evidence_refs": ["S004-E1", "S004-E2"], "evidence_gaps": [], "confidence": "high"}],
        "clarification_required": false
      },
      "annotation_history": [
        {"version": 1, "actor": "synthetic_fixture_author", "action": "drafted_delete_issue", "reason": "Captured the initial utterance."},
        {"version": 2, "actor": "synthetic_fixture_author", "action": "retracted_delete_and_labelled_archive", "reason": "The same utterance self-corrects and UI evidence confirms Delete is visible."}
      ]
    },
    {
      "session_id": "SYN-005",
      "title": "Ambiguous design preference",
      "families": ["zero_confirmed_issues", "ambiguous_intent", "clarification_required"],
      "synthetic": true,